try this httpphpnetmanualenfunctionceilphp,1
use ceil function in php httpphpnetmanualenfunctionceilphp,1
i just googled your exact question and found this httpswwwgooglecomsearchqroundnumberinphpieutf8oeutf8,1
duplicate of how do i round a number up in phphttpstackoverflowcomquestions257032howdoiroundanumberupinphp,1
have you tried anythingpost what you have done until now so we can help,1
are you not using generics  why are you having multiple data types within the same arraylist ,1
whats your actual question,1
  these could be strings or characters,1
yes off course what you want to do can you add sample input  output,1
what you not understand,1
im voting to close this question as offtopic because it is not about programming as defined in the help guidelines its also potentially asking for legal advice depending on the jurisdiction where the poster resides and this is not a legal advice site,1
im voting to close this question as offtopic because its not directly about programming or coding,1
stdstringnpos it is just scope resolution saying nops is from string scope and the string is in std scope  and sizet count0 isnt a syntax error ,1
  no sizet count0 is not a syntax error it initializes the sizet count to the value 0 think of what it would mean if instead of sizet you had a userdefined type lets just take vector for example stdvectorint myvector0 is not a syntax error,1
   yes got it  and sizet is just returntype userd for sizeof,1
you forgot to assign your variable link  linkreplace2f  and link  linkreplace3a ,1
what means doesn´t work please be more specific on what you´ve tried and what you expect to get and what you get instead,1
youll need to provide more detail that that  how about examples,1
thank you so much eg word cat shuffle like ctaatc and so on  second input string suppose tac in case if matches with any of the random shuffle string return in boolean,1
do you mean you want to find if input word 1 is an anagram of input word 2,1
yes if word 1 is an anagram of second srting,1
the article element represents a complete or selfcontained composition in a document page application or site and that is in principle independently distributable or reusable eg in syndication this could be a forum post a magazine or newspaper article a blog entry a usersubmitted comment an interactive widget or gadget or any other independent item of content a div is just a generic block element with no real semantic meaning article is more specific and semantic for article content httpswwww3orgtrhtml5sectionshtmlthearticleelement,1
" use when you try to call smt from pointer to struct
 when you create object and call",1
if you cant find any difference try replacing one with the other without changing anything else and see if your program still compiles ,1
what does your data look like what does your struct look like could you give a minimal example,1
highest downvote of the day  ,1
what does the text book tell about these operators,1
yeah you are guys are   i m noob   but tell me how can i master in android,1
x  128 is it,1
  nope im trying to shorten x  128  x,1
so i guess that is the only way to subtract it,1
  yes x is always smaller than or equal to 128,1
where did this error come from what was your code what kind of interpreter are you using,1
my compiler threw an error no code found please post your code an error,1
welcome to stackoverflow please read the topics in help center  askinghttpsstackoverflowcomhelpasking your question is in danger of being closed if you dont improve it,1
"print welcome to the gaming quiz all of your answers in the quiz must be all lowercase include spaces and be spelt right                           
print question 1
x  input what call of duty was released in 2015
if input  x
    print sorry that was incorrect better luck next time",1
thats my code using python 36 edited by idle,1
you have two print functions on one line,1
no sorry thats just  the way it copy pastes you can see the screenshot i linked in the original question,1
im talking about the screenshot,1
sorry but even after i fixed that it still doesnt work,1
sounds like you have some nonvisible or hidden null bytes in your code similar to the behavior in this question python source code string cannot contain null byteshttpsstackoverflowcomquestions31233777pythonsourcecodestringcannotcontainnullbytes but of course on windows you might want to try copying the text from idle into another text editor that can view hiddennonascii encoding inspect for and remove any unusual characters then paste the cleaned text back into idle and try running the code again my guess something near that grey block between the print and x,1
also you could press edithttpsstackoverflowcomposts45065685edit on your question and copypaste the code into your question and let us view the text to check for hidden characters,1
was trying to separate admin and fronted what does it mean ,1
md abutaleb thank you for reference but i have checked it,1
sagar gautam  that means  i tried  ,1
what is the max index for an array of 24 elements what will the max index be in a loop like while s  24 where s is the index,1
dont know how on visual studio,1
as in maximum temperature,1
   dont know how on visual studio  so you didnt see debug in the main window of visual studio and wondered what it does  or hit f10 on a successful build of your program,1
  using a debugger is an essential skill for any programmer its very easy with visual studio a quick google search will give you tons of resources to guide you,1
  visual studio has integrated debugger search for online tutorials on how to use it,1
guys there is no error copy the code and use it to see my problemhttpsstackoverflowcomusers7359094franc3a7oisandrieux,1
google how to debug small programs read and implement,1
   you mean there are no compilation errors not runtime or logic errors  just because your program compiles without any syntax errors doesnt mean your program is free of bugs  also some advice  instead of 24 number try instead something much smaller like 5 numbers  that way it will be much easier for you to see where your program goes wrong,1
dude there is not a single error there is no errors i used the debugger and the compiler and there is no error,1
what else   ,1
  debugger doesnt show errors on its own you are supposed to step through your program while watching the values of the variables to figure out where the code functionality deviates from your expectations,1
if you had stepped through with your debugger and used a smaller easiertofollow top limit as suggested much earlier by   your would have spotted many errors,1
you have many many errors that you should have seen when running under your debugger,1
do note that void main is an error  main must return a int,1
please read under what circumstances may i add “urgent” or other similar phrases to my question in order to obtain faster answersmetastackoverflowcomq326569  the summary is that this is not an ideal way to address volunteers and is probably counterproductive to obtaining answers please refrain from adding this to your questions this is likely to be one reason why you got so many downvotes,1
httpswwwgooglecomsearchqjavascripthelloname,1
no probably  you should give up and leave your competitor alone unless you like jail time,1
  i would have figured with a username like that you would already know how,1
i hope i did not offend anyone by asking this question i am not planning to do anything nefarious with the ip addresses this is simply for analytical purposes to find out how much traffic is arriving on my competitors website and also their geographic location so that i can narrow the range of my marketing to the required regions i suppose im looking for something similar to google analytics short of using malware which i believe is unethical would it be possible to acquire the ip addresses through a registry for example if my competitor and i share the same client information,1
now a days every task related with polling or long polling is considered a bad practice you should take a look to some listeners for that,1
φxocę웃пepeúpaツ could you elaborate ,1
have you tried using max herehttpsdocsoraclecomcdb1930601server102b14200functions085htm is a link that will help you get started if youre not familiar,1
also do you make a habit of insulting people who are trying to help you how does that work out generally,1
first of all i got the solution and  im not insulting him just telling him to read my q once again  ,1
  i think the 4 score on his question answers yours,1
in addition to the immediately downvote add at least a text with hello mr yve please let us know what youve already tried and show us some example code you wrote we are not a code writing machine and are here to help not to solve your homework or complete your customer desires,1
any attempts from you did you try anything,1
have you tried searching for object recognition on httppypipythonorg ,1
  thanks i am going to try it,1
questions asking us to recommend or find a book tool software library tutorial or other offsite resource are offtopic for stack overflow as they tend to attract opinionated answers and spam instead describe the problem and what has been done so far to solve it,1
please move your code and everything to here instead of putting a link,1
"public class vendingmachine 

    public int cancount
    public int tokencount

    vendingmachine 
        cancount  10
       tokencount  0
    

    vendingmachineint cans 
        cancount  cans
       tokencount  0
    

    public void addint cans 
        cancount  cancount  cans
    

    public boolean inserttoken 
        if cancount  0 
            return false
         else 
            cancount  cancount  1
            tokencount  tokencount  1
        
        return true
    ",1
"public int getcancount 
        return cancount
    

    public int gettokencount 
        return tokencount
    

",1
edit your question and insert your code there its not readable in a comment,1
what do you mean by not working what tests did you run whats the output,1
javascript  java,1
whats your main method looks like add input and expected output,1
im going to guess in your main method you created a vendingmachine with 20 cans or 10 cans and add10 cans then inserttokenx2 theres your output,1
its because of machineadd10 either delete it or rewrite your expected count,1
why do you expect tokencount to be 0 in first place,1
"here is my teachers requirement for the codeprovide two constructors for the vendingmachine class
1 a default constructor vendingmachine that initializes the vending machine with
10 soda cans
2 a constructor vendingmachineint cans that initializes the vending machine
with the given number of cans
both constructors should initialize the token count to 0",1
it does what its supposed to do,1
im just trying to figure out what correction should i make in order to let the token count to be 0,1
in what scenario if youre trying to simulate a vending machine i guess each can should have a price and then when you insert tokens it accumulates them until it reached that price then youd zeroize the tokens number is that what youre trying to do,1
put pdbtrace before that line and try to print weight from that console,1
remove weight  global weight weight is already a global variable,1
  wait does weight  global weight not give you a syntax error it does for me both in py 2 and in py 3 so i dont think thats their real code,1
  it does there is more than one reason to remove that line,1
op please show us the real code the code that you included has a syntax error and there is no need to include those verbose user instructions,1
i removed the line you guys told me to but now it still tells me that weight isnt defined when i asked the user for it at the beginning of the program i really appreciate the help,1
i updated the original post with the code i currently have along with the functions,1
this programming language claims my is never a good start to a question never  99999999999999 of the time it is correct and it is very unlikely you found a bug in the language,1
please give us the exact error message full traceback not just python is telling me that weight isnt defined,1
please try to make a minimal code which actually shows the error ie i can run it and get the same error you are having it looks like you removed the part which is the actual cause of the problem but you dont know it for example an assignment to weight after the line with error and show the exact exception you are getting,1
"this is the full traceback error that i am getting 
traceback most recent call last
  file usersmichaeldesktopvickys gymvickypy line 23 in module
    printcaloriestimerequiredruncaloriestoburnoff calsburnedperminrunning
  file usersmichaeldesktopvickys gymcaloriespy line 22 in timerequiredrun
    calsburnedperminrunning  burnedrunningweight
nameerror name weight is not defined",1
as i expected the error is in a function the function is named timerequiredrun and we do not see that function even though we do see a lot of code so there is your problem you are giving us misinformation so you get no useful answers,1
please see why is “can someone help me” not an actual questionhttpmetastackoverflowcomq284236,1
lists arent considered string objects but   is so     is concatenating a string to the lists,1
"i get the same error when i remove double quotes as shown below    csrpgprimaryprimaryp  primaryg   primaryain   primaryaout   primarydin   primarydout
primaryg nsup
typeerror cannot concatenate str and list objects
primaryain a
primaryaout b
primarydin sel
primarydout ",1
please edit that into the question,1
what are these interspersed primaryg nsup and what are they supposed to tell us,1
and if that means primaryg is nsup… well then it is a string youre trying to concat with a list,1
those are just output from my print statements,1
"printprimaryp primaryp
    printprimaryg primaryg
    printprimaryain primaryain
    printprimaryaout primaryaout
    printprimarydin primarydin
    printprimarydout primarydout",1
it works if i only concatenate first two lists problem starts from third list onwards csrpgprimaryprimaryp  primaryg  works fine,1
at least one of the things you think is a list is not a list presumably everything that outputs as  instead of ,1
thats the bit im not able to understand i agree with you that first two elements im trying to addprimarypprimaryg dont look like list but more like strings however all six things im trying to add i declared them as lists and for firs two im just appending strings to them for eg primarypappendportname  where portname is a string now my understanding is even though portname is string now it has been added to a primarp list why it is giving an error when im trying to add primaryp to a bigger list csrpgprimary,1
hope i made the question clear code is so big that i dont want to post here and add confusion but my basic question is astringa a bxyzbiglist aappenda now if i do biglistab shouldnt that work,1
the problem is with 99999 certainty that somewhere in your “big code” you’re replacing the list with a string not appending to it,1
please provide mcve in the question itself,1
knowing how to debug a programhttpsericlippertcom20140305howtodebugsmallprograms comes handy in situations like these there are many debugging techniques that can be used to help you understand a program and its flow,1
a whiletrue loop will continue until something inside that loop ends it usually via a break return throw or some processwide exit condition such as stdterminate stack overflow users are not going to navigate a repository to understand your question for a complete answer provide the relevant code or a mcve directly in the question,1
post code in the question  not a link  its meaningless when the link goes stale or updated and some proxys will ban github,1
the link doesnt even go to a specific piece of code it goes to 360 lines of code across two files,1
possible duplicate of what is the usage of while1httpsstackoverflowcomquestions37056975whatistheusageofwhile1,1
given the two questions at the end what is your point in giving all the code you dont seem to be expressing yourself clearly what are you trying to ask that is maybe a clarification of your title,1
how do you get the list of directories please edit the question to show what you currently have,1
num1 is post increment in next line after printf if num1 is used its value will be 2,1
go with printfnum1d num1,1
  this is not the case but imagine a python programmer seing the  operator for the first time that programmer may be a python wizard but that operator doesnt exist in their language,1
what made you think it doesnt increment it the code you posted does not check the value of num after ,1
and if you dont understand the difference you need to find a good beginners bookhttpstackoverflowcomquestions562303thedefinitivecbookguideandlist to read,1
  you cant be a wizard at anything without the skill to find the basic information in docs,1
  im not buying it chapter 2 of any tutorial will you teach about prefix and postfix,1
  not a duplicate of that one imo that one is full of ub and dubious casts,1
second result on googlehttpencppreferencecomwcpplanguageoperatorincdec i mean i dont think im a wizard,1
  looking for what exactly,1
  youre right i should have checked a bit more carefully,1
add another printfd num1,1
possible duplicate of what is the difference between i and ihttpsstackoverflowcomquestions24853whatisthedifferencebetweeniandi,1
hint its using jquery,1
prints hello world to the consolehttpswebmastersstackexchangecomquestions8525howdoiopenthejavascriptconsoleindifferentbrowsers when the documenthttpsdevelopermozillaorgenusdocswebapidocument finishes loaded using jqueryhttpslearnjquerycomusingjquerycoredocumentready,1
thanks   thats what i thought but wasnt sure,1
i am checking the documentation now and can see lots of similar examples thanks all,1
this vardump will obviously give false otherwise the question would not have been asked,1
this is not the yii way he was using the correct way to do it,1
no sqlalchemy requires a callable  if you add the parentheses you get a constant value for all entries,1
  somethingmyfunc returns the function itself without calling it this is desired behavior if you called the function youd be retrieving only a single time and using that as the default which is a different behavior and not desired,1
i am new in share point i dont know what to do and how to do,1
for starters why have 4 tables why not have 1 with a login type field,1
you shouldnt be asking the question how to make the login page but more on how to come up with the correct sql to check your login retag your post with the type of db you are using and you may get better answers,1
use regex httpenwikipediaorgwikiregularexpression,1
you dont even need regex for this,1
well what syntax are you talking about,1
i could find something on the code projecthttpwwwcodeprojectcomarticles15934howtoconvertanumericvalueorcurrencytoengl,1
extend this for doubles httpstackoverflowcoma3267284240,1
i didnt try anything i thought that there is a builin method for doing this,1
does stringsubstring not do what you want,1
how do you want to handle these strings a xx welcome welcome b xx  welcome welcome xx c xx welcome xx,1
"i found solution

sindexof",1
what is your cssbrowserhtml,1
is this a displaystyle issue or php,1
this may sound obvious but if you look at the inner exception it will likely tell you what error is not being set  this is almost certainly caused by not instantiating an object  if you dont know how to check the inner exception which line is it crashing on,1
by looking at your inner exception you should be able to find out what line your problem is on and from that what is causing your problem,1
whats the name for f3221c,1
dont know about you but id prefer using more than these colors httpwwww3orgtrcss3colorsvgcolor,1
thanks for response we have ability to launch an app from another app pls see answer in my post maybe this help you in the future,1
why do u think controller also needs to be prototype,1
where do i need to insert this piece of code on jsp,1
this does not what the op described he wants to,1
"its not possible to embed an serverside application ie exe file into a jsp you can embed an object tag object idmsword width100 height100
classidclsid0002090600000000c000000000000046
datahttplocalhosttestwordtestdoc
object into your jsp this will open embed the application into the page it requires the client to have the application installed is not really a part of the jsp its part of the rendered html page",1
yes i want to do something of this sort only i have downloaded the exe now i want to run it on my jsp page,1
includemyfilephp gives me a the function doesnt exist   include myfilephp  gives me a unable to find the template,1
  what actually kept in your myfilephp  is it a template  can you post the myfilephp ,1
try to read this httpsmsmvpscomblogsjonskeetarchive20100829writingtheperfectquestionaspx,1
i think you are looking for some mass mailer programs available  you may google for it i think httpwwwmassmailersoftcom should suit you,1
  yadav thanks a lot but is there a freeware tool,1
  i think this might suit you httppommoorgmainpage,1
he wants to do it programmatically not through config,1
whats your goal in doing this,1
why do you want to do that  if its something like having a user type 1 to refer to the first item just subtract 1,1
okay maybe its really not the best waychanged decision,1
what did you attempt,1
that gets the things that chickfila likes not who likes chickfila,1
yeah you are right but we get userid which is used for get name,1
hes asking about actually moving the users caret to the element not just styling selected elements,1
do you have a specific example youd like to work on,1
update and insert or update and delete  your title and question say two different things,1
switch code blocks do what is called fallthrough which simply means any value passed to your switchdepartment block with results in case 99 display  store use if you want to prevent fallthrough you must add break at the end of each case statement,1
why dont you make the fixes that are being given to you  insert the missing parens and braces etc,1
you need some introductory books on java and android programming  these are very basic errors,1
sorry kevin but that escape function only escapes xml not sql httpmsdnmicrosoftcomenuslibrarysystemsecuritysecurityelementescapeaspx,1
please post some code how you have implemented your uiscrollview,1
can you please provide a link to the problem the formula you used to solve preferably with your current code so that others can optimize it also if you found the formula any specific reason to use brute force,1
bruteforce methods tend to be slow,1
define brute force without a formula you can still memoizehttpenwikipediaorgwikimemoization i suppose that might still be brute force  just a litte less brute,1
please provide more details post your design so we can see what you are trying to accomplish also tell us what you have already tried also please accept answers to your questions,1
there could be many reason without providing specific input cant help you out you should post your question with some details how can we understand what your psd is and what you have converted,1
show us the code that fails,1
show us some xaml  code please,1
might be a duplicate  see here httpstackoverflowcomquestions5382164wpfbindingexpressionpatherrorpropertynotfoundonobject,1
  thanks for the pointer i was looking for more of a tutorial into why it works the way it does which is i didnt post any code the link you added does point me in the right direction,1
httpdeveloperandroidcomguidedevelopingindexhtml,1
it will have it if you make it,1
what is wrong with question,1
are there any libs,1
could you write what you tried,1
i just write two class inside the first class i declare a variable getdata  xxx but i need this get data value to another class  what to do,1
show us your code,1
why did i not see that ive looked at that page before,1
actually do you know of any other way to animate before api 11,1
at the righttop corner of the page you will find since api level 11,1
yeah just seen that,1
sure you can use animationhttpdeveloperandroidcomreferenceandroidviewanimationanimationhtml to animate your views,1
lovely thanks for that,1
  wait isnt that list for jscript even though it probably mostly applies to c too the one for c is here httpmsdnmicrosoftcomenuslibrary126fe14kvvs100aspx,1
why dont you want to use css,1
no way to do this without css but really if you have no css the default should already do this,1
why would you want to do this without css thats exactly what is for,1
what else do you expect other than css and js ,1
what do you mean seen as already clicked visuallystyle programatically an attribute,1
everything you need to know is here httpdeveloperandroidcomindexhtml,1
thank you for your answer sir,1
you are definitely right matteo mosca i somehow forgot to even post the code but the problem was solved using displayinlineblock like like redx suggested,1
  then it was always the area of the div and not to the right of ,1
a rails model is not a table nor any other part of the database while commanding generate model foo creates a corresponding database migration for creating a table for storing instances of foo commanding destroy model foo doesnt destroy the table  as httprailsforumcomviewtopicphppid10961p10961 says beware though  when you generate a model it creates a database migration if you run destroy on that model it will delete the migration file but not the database table ,1
