afaik getscripturl gets the script and executes it you will have access to the variables in the script but not the source itself,1
 ñamaque what if i get response without xhr ,1
   thank you i believe your comment is the most helpful here,1
so   what is it that youre trying to do your question is unclear please elaborate,1
well you can display external javascript content in a div on some browsers like chrome yet you may not really access it,1
please post a code example,1
share some code sample  that would help resolve where you are wrong,1
show us the code which is not working,1
what do you mean by comparing a character using char and d ,1
i would strongly recommend you read a book on c,1
to gain more memory you use realloc,1
  that wouldnt work here as realloc requires an initialized pointer to start with,1
"you are overwriting random memory areas that you did not reserved not only you can corrupt data but also you have no guarantee that you will be able to retrieve the data you wrote
more likely you will end up in a segfault because this is undefined behavior",1
  yes my point is to gain more you have to have something first so malloc is not to gain more it is realloc but malloc should be used first,1
  kim it is a splendid idea i like it let the compiler bothers about allocating memory somewhere where it likes,1
  kim your program would look even better if you add one minor detail including a word in the print statement for example  printfenter the maximum number of money you want ,1
  false realloc when passed a null pointer behaves like malloc,1
  but that would change the meaning maybe he wants to know what is the maximum number you want to have maybe its a count von count emulatord,1
  null is a value uninitialized pointers arent null and null pointers are initialized eg msvc will set uninitialized pointers to 0xcdcdcdcd in debug mode so you can spot the bug,1
httpphpnetmanualenfunctionsargumentsphpfunctionsvariablearglist,1
   not always but instead of asking how to convert this you should perhaps have started out with your second edit minus calling me a weirdo and told us you where looking for alternatives perhaps it wouldve been received better,1
  i thought that this is a too easy to answer question to overexplain myself but i guess i was wrong,1
  never assume something on other peoples behalf secondly writing a good question not only benefits you with a proper  good answer but future people as well who might seek the same information,1
e means scientific notation 14 means 1 digit before the decimal point and 4 after this doesnt require an so question really just look it up,1
did you try doing man printf try google the first link youll see is httplinuxdienetman3printf why dont you read it once,1
  the 1 is the minimum field width  in this format you cant get less than 5 characters generated because the exponent is printed with e a sign and 2 digits plus at least one digit before the exponent so the width is functionally ignored here  the 4 does mean 4 decimal places  if you changed the conversion specification to 104en youd get 31416e01 and using 134en youd get    31416e01 note that e formats always print just one digit before the decimal point,1
httpencppreferencecomwcppiocfprintf a simple google search will return the printf format right away,1
have you already tried something if so include code,1
"   sorry i didnt try anything major as i am not good in awk sed just started learning
this command reads a file replaces the nulls with zero but not able to proceed further as sorting is not working
cat fllenametxt   awk f t  print 1 2 sort t k2",1
there isnt really a right answer my personal way is to do all the html with the classes i need then style that css shouldnt dictate the semantics and structure of my page,1
try to write javascript first and let us know about experiences ,1
isnt that a bit like building a car by trying to assemble all the plastic bits then all the metal bits then all the rubber bits ,1
your structure is indeed the most important thing as it focuses on the content if you ever redesign your site you only need to change css and js and not the whole thing so html first then css as some people use your site with javascript disabled then javascript  javascript should be icing on the cake not the main focus,1
"there is no one best way to make a website because it is personal preference but it is always good to plan out beforehand exactly what you plan on putting in the website drawings mockups animation sketches if you dont have much experience with designing websites i would then suggest completely writing up the html not simply with divs but using good html practices such as this httpistackimgurcomb73dvjpg

then take your time designing the elements in css and javascript once you have a full skeleton of html to work on and mockups to lead your way",1
you shouldnt have to rewrite all your css if you change your code youre doing css wrong if you do,1
are you sure your code enters the loop,1
you never enter the while loop the condition in it is always false why not using a debugger first,1
matthewd i have tried selectionsheets but i cant think of any other way to point at the selection,1
because asking for codesoftware is explicitly offtopic,1
when matthewd ask what you have tried he wanted you to post in your original post an example of the code you have tried,1
take a good look at how do i ask a good questionhttpstackoverflowcomhelphowtoask,1
selection has a very specific meaning within vba it is not ambiguous,1
it does mean something correct  if youre using select then you have already selected a range with a sheet  how are you selecting this range where does it come from please can you expand your question,1
i think you should watch that video again  start at 430 and pay attention for at least three minutes  compare your code to their code  whats different,1
add some code please,1
welcome to so your question is getting downvotes because it doesnt really fit the model for good questions here take the tourhttpstackoverflowcomtour and familiarise yourself with the way we work here and try editing your question to better fit the guidelines on asking a good questionhttpstackoverflowcomhelphowtoask,1
your expected result is not an array of items,1
welcome to stack overflow questions seeking debugging help why isnt this code working must include the desired behavior a specific problem or error and the shortest code necessary to reproduce it in the question itself questions without a clear problem statement are not useful to other readers see how to create a minimal complete and verifiable examplehttpstackoverflowcomhelpmcve,1
did you really write iostream also main needs an int return type,1
no i dont need an int return type thats why i dont know how to do it,1
let me rephrase main has to have an int return type it is a rule so write int main you dont actually have to return anything from the function because main has an implicit return 0,1
this one 0  105  10 is the same as 0  105  10 and gets the expected value by chance both true  10 and false  10 will display true,1
your text editor has nothing to do with your issues for starters probably not wise to use spaces in filenames you probably dont want to use local paths finally i understand you are a beginner but i think you may need to do a few more tutorials for both html and js you have some malformed html and your js has a lot of issues check your browser console f12 and look into those errors,1
could you clarify what you mean by this call doesnt work do you mean the call to program if so what output does it produce as compared to the output that you anticipate it should produce,1
  actually i bet its harder to find than you think its easy when you know the answer cos you know what to search for for a new programmer this behaviour is a surprise and they dont know what to search for he says he looked a lot  i believe him,1
  i looked it up bing actually and all that came up was things like how to call external programs from a c program and how to call c c etc programs for a c program,1
  ill edit an update,1
    well the compiler error is probably a good place to start  program was not declared in this scope,1
  tew  note that calling program from inside program is not the way to go you should use a while loop,1
  yes this is an example though of course in an actual program i would use a dowhile loop,1
also why am i receiving so many negative votes i feel this is an appropriate question for this forum,1
  its not a forum to be technical about it,1
are the 3 classes in the same file,1
you dont youre trying to execute adder try running sol,1
no its not compulsory to define a main method in a class that extends an abstract class there might be some other issues,1
also it may be possible that you are trying to execute adder you must have to execute sol,1
  am actually executing the sol class which says to define main method in adder class,1
please use public in front of your static void mainstring atgs as if you donnt use public this will make defaultand not be called by jvm,1
public static void mainstring args is the standard main signature which the compiler looks for,1
  have u tried after using public in front of main,1
  yeah it worked fine now thanks dude,1
   actually the compiler doesnt look for it  the compiler doesnt care if there is a main method at all  it is the java command that looks for the main method,1
i have done just now but i think ive messed up each method with the above options in is just returning 0 they do complile though which is the main thing i guess,1
i know its a shocker kocko i apologise just clutching at straws here,1
it is always 0 that is very strange since you never set a value to x there is absolutely no possible way that x has its default value ,1
think ive completely messed up the test class i just made,1
maybe you can provide something more to have a minimum working example mwe,1
see matlabs documentation for interpolationhttpwwwmathworkscomhelpmatlabinterpolation1html,1
i am not able to understand the documentation thats why i have asked for help and if anyone good with matlab be able to help it will be very good,1
  cuttin i haev added a image  it is the output file that i am getting however i want a continuous surface,1
it looks like you have a problem with the shape and distribution of your data please check the example of displaying nonuniform data on a surface in the representing data as a surface documentationhttpwwwmathworkscomhelpmatlabvisualizerepresentingamatrixasasurfacehtml and report back,1
the 6 is probably for urgent please dont get into the habit of spoiling your questions with that please  if only because too many downvotes will lock your account from asking new questions,1
"  i have scatteredinterpolant which generated a matrix like this
f  

  scatteredinterpolant with properties

                 points 40000x2 double
                 values 40000x1 double
                 method linear
    extrapolationmethod linear

now how to use this matrix in matlab",1
  scatteredinterpolant would create a function not a matrix then you can use that function to create a surface you can start by checking the ezsurf command,1
which two lists what is the contents of var1 an integer value a commaseparated list of integers what has classa to do with your question what have you tried,1
see this httpstackoverflowcomquestions3669970comparetwolisttobjectsforequalityignoringorder and some other posts,1
i have tried this solution got the error at least one argument has to implement icomparable interface,1
your post is a little better already still it is unclear what var1 has to do with it,1
i want to exclude the value of var1 of class b while comparing the lst1 and lst2,1
  please let the thinking be done by op dont rewrite his post to reflect what you think the problem is,1
normally i would do what you suggest but apparently the asker had trouble defining what he meant by trying to describe it precisely i thought id help him rephrase the question if my editing wasnt exactly what he wanted in the help i read the following phrase be sure that youve read the close notice and any comments on the question so you can address any concerns raised there addressing the concerns often means editing the post  which any user may do ,1
step 1 create a class that implements iequalitycomparerclassahttpsmsdnmicrosoftcomlibraryms132151aspx and does the exact equality comparison you want for this case step 2 if lst1sequenceequalslst2 instanceoftheequalitycomparer   not sequence equal  ,1
  your answer really works,1
onchanage theres no chanage event that i know of,1
please take a few minutes to learn how to pull up the javascript console in the browser of your choice that way you will be able to tell us what errors are occurring and what you dont understand about them thanks,1
simply use onchange  event to do it,1
you can do it also by using jquery,1
"here onchanage spelling is wrong and you have missed few things here
documentbgcolorthisoptionthisselectedindex
check itbelow i have posted an answer what you want",1
did you try anything so far,1
i know how to use timespan to get the difference but how to set the limit using seconds and switch to mintues this is where i need help,1
help would imply you have posted code which gives us a starting point,1
take a look at the momentjs library or the livestampjs library  i think youll find what you need there,1
"  if you are familiar with what you say the you should be familiar with the following timespan duration property and if you create an instance of timespan object then you can get at the following for example 
tsdurationdays 
tsdurationhours 
tsdurationminutes
tsdurationseconds as well as txdays tshours tsminutes tsseconds",1
  yes i am familiar with that but howwhen to let it choose what to return based on difference value for example if the difference between dates is 120 mintues i do not want it to return it 120 mintues i want it to return 2 hours  how to make this switch ,1
check this out for starters and there are several examples on so as well i actually used one today and it worked most amazingly httpwwwdotnetperlscomstopwatch,1
why the downvote,1
have the function return a value and decide what to do in the calling function based on that value,1
looks like c exception at some point,1
   the question is not whether it makes sense to you the goal obviously is error handling i am hoping to achieve the interruption of a deep call chain without having to check return values,1
what do you mean by portable i know that gcc has a feature for goto across functions but wont work on other compilers,1
   it seems applicable in this scenario but it is just a small example and is not applicable in the scenario i intend to use it,1
   i added gcc as a tag to specify it is a given so by portable i mean platform portability while still using gcc,1
why is your idea simpler of better then simply returning a value from foo and having bar either return or execute somewhereelse conditionally  the point is your example does not justify the mechanism when sensible design using basic mechanisms of the language suffice in your example situation  more generally perhaps c exception handling is what you need,1
   yes it is just an example its point is to illustrate what i want to achieve not how it makes sense in actual code unfortunately i cannot use c,1
you are reinventing longjmp if you want that to be portable and general and compatible with recursive functions,1
   well not all of our systems come with a spare 150 gigs of ram to afford to be reasonable with a billion longjmps,1
a billion longjmp  will generally use a constant memory space of a hundred bytes they wont even spend a single megabyte and the billion calls to longjmp will require a few seconds in total each of them lasting a few dozens of nanoseconds,1
   somehow and amazingly so you are still missing the point that it is about error handling and achieving in practice stack unwingding so those billion jumps will require a billion buffers in fact the buffers will end up being there even if no jumps are made so to my question about zero cost error handling you are answering with a solution with an impossible cost,1
no my improved answer show that there is no billion buffer in heap only one single jmpbuf  temporarily on the call stack,1
so how do you trace back your n  1 number of steps with only one jump buffer nobody is talking about heap but the deeper you go the more buffers you leave behind so you can make the jump if you have to you can at best limit it to one buffer for each stack frame reusing the same buffer if there are more than one error prone operations per frame,1
please read more about longjmp it can unwind dozens of thousands of call frames in constant time and most call stacks dont have that much a typical call stack cannot exceed a few megabytes on most laptops,1
i am well aware of the typical stack sizes but even though the stack as a memory buffer is a flat object what happens inside has a tree structure storing a jump buffer on every frame in a deep call chain will run out of stack space in no time since even if the buffer only stores a few registers it is still a constant size construct might have been nice if the compiler actually trimmed it down to only what is needed to store a particular state,1
see my example you dont store a jmpbuf in most call frames only in some initial ones,1
as a caution lets keep this discussion civil and avoid pointed comments about other users,1
  if you dont store each of the steps then the stack unwinding will not collect all the objects in between it will all leak which is why your solution is utterly useless the goal is not to get back to where you started it is to do so and properly collect all objects along the call stack this will require a lot of jump buffers and will result in massive cpu and memory overhead,1
you could provide the code you have already written and point out where you are struggeling this would make it more likely that you´ll be getting an answer,1
youll do better here if you post code and ask questions about specific difficulties  this isnt a haz the codez site,1
how may it fail if 2 strings are given as parameters isnt there only 3 options about a comparison between them,1
how do you imagine a situation that it fails except when a null pointer is passed otherwise its just a comparison that returns how the strings compares,1
it will fail if the strings arent null terminated,1
the only ways strcmp can fail are if you pass one or two null pointers or if the strings are not properly null terminated but they need to be similar chunks of data because strcmp stops as soon as theres a difference   however that invokes undefined behaviour so anything can happen and it is valid,1
do you understand the difference between a keyword and a function call,1
yes i understand what i wanna know is how compiler handles int char etc ,1
a fundamental type is not a function it does not need to be declared its fundamental nor do basic keywords need to be declared how would you declare such things without using basic keywords,1
with all due respect no you dont please read a basic c book first,1
the compiler knows how to handle basic types and keywords because their behaviour is specified by the standard and the compiler must implement this behaviour using whichever resources are available on the architecture used for compilation this is circular logic the compiler must know how to do such basic things otherwise it couldnt compile,1
thats what i wanna know  how the compiler knows ,1
are you asking about how a compiler knows the spec for the supported language,1
printf is not defined in a header but only declared,1
languages have grammar constructs sometimes types and keywords functions are build using these things that make up a language printf is a function return is a keyword int and char are types the basic format of a function is defined by the grammar ie returntype name args  function body  compiling an expression like int a doesnt call a function its simply using the language printf is invoking a function if the compiler doesnt know about that function theres a problem its pretty obvious isnt it,1
  a compiler is just another program it reads input your code and processes it according to a set of builtin rules  it recognizes keywords like int and char and return because it was written to recognize those things,1
this example does not show any use of exception filters,1
this is standard way to filter exception in c60,1
take a look again at what exactly exception filters are you are not using an exception filter in your example theres a proper example in this answerhttpstackoverflowcoma22864936247702 posted a year before yours,1
an example of exception filtering would be catch httpexception e when egethttpcode  400  writelinebad request ,1
this does not show a way to filter exceptions ,1
doesnt work even with relativelayout parent scrollview is the problem,1
please refer to the code above i am adding the progressbar to linearlayout and the linearlayout is in scrollview even if i replace the intermediary linearlayout with relativelayout that does not solve the problem,1
i was asking you to do  something similar to what gvs13 has mentioned in his answer  i believe its correct isnt that working for you,1
i never add such requests in my questions this question is special i read over 20 similar questions i did not want people to assume its one of them few people just copy code and some downvote   preventing future readers from taking it seriously i was not complaining  i was just afraid of not getting a solution to my query because people did not even read my question,1
if you are going to say this is not a duplicate then say which questions it is not a duplicate of and why from httpstackoverflowcomhelphowtoask including links to related questions that havent helped can help others in understanding how your question is different from the rest,1
this question is being discussed on metahttpmetastackoverflowcomq318249119775,1
i assume you know programming android is based on java so building algorithm i can help with some a primitive algorithm solution for you but you need to implement the ui and the java code in your android app as if i also should do that it will be full project and that is not the idea let me know if i should processed,1
myfunction should return an int,1
the writeline meth is is trying to output a value but myfunction isnt returning a value the return value is void,1
which language are you using make up your mind c or c,1
i was using c but then a friend suggested to me the swapab and that seemed to be c and it lost me because ive never used that command before,1
its incredibly easy to make your own swap function id suggest doing that and editing out c from your question,1
your main routine is defining and initializing deck but does nothing beyond that so what is your expected behaviour,1
yeah i just took out the c portion from it how could i make a swap function in my case this program can be run on visual studio 2013 the command prompt just doesnt have anything except press any key to continue and i cant figure out whats wrong,1
  uhh it seems you already have a swap function you wrote its in your code,1
is there anything else that could be added to my main i didnt know what else to put besides my array,1
  like i said though a friend suggested me to use it but i had never used it before,1
  im confused the swap function in your program doesnt depend on c its valid c code,1
possible duplicate of programming homework deck of cards dealt to players  c programminghttpstackoverflowcomquestions36705850programminghomeworkdeckofcardsdealttoplayerscprogramming,1
  thats not a duplicate thats another post that i made earlier today when i read the comments and realized my structure was completely off i didnt know how to fix it i decided to try a different approach to the assignment,1
  in that question you were calling functions in main but not here now,1
i will try and fix my main problem thanks for the feedback everyone,1
this code doesnt even compile because the number of arguments in the definition of distributecards doesnt match the number of arguments in the declaration of the prototype before,1
disagree with every and single line of the answer same comments were made for strict aliasing optimizations and those hopefully are dismissed now the solution is to educate developers not prevent optimizations based on bad development habits,1
it is a reasonable thing to argue that the standard is broken regarding this being allowed to be null for nonvcalls i dont necessarily agree but thats a fine opinion to hold for other optimizations eg the felixgcc one it is very hard to teach a compiler what is ok to optimize and what a human intended that is architecturally very unclean and might be practically impossible linus torvalds has made the same error once about an optimized out null check,1
pretty much every realworld program is undefined  not sure what is the basis of this claim the systems i work with do not rely on undefined behaviour and when such is discovered because people make mistakes it is treated as bug and fixed rather than blaming it on the compiler,1
  you can turn on that behavior using a switch and i would not condemn you for doing that i find the idea of safer versions of c and c very useful but it costs your performance in certain loops c generally is a language that is supposed to be so close to the metal that there is not enough room below c and above assembler for another language,1
  the problem with a switch is it is old code which needs that behaviour that is the code where by definition the makefile does not have the switch because it did not exist when the code was written,1
