why do you not want to use a return value on the recursive method,1
1 check that n  1 return if not 2 call recseqn  1 3 print 1  n,1
if anyone can point out some reference it is greatly appreciated,1
httpswwwtutorialspointcomjavajavaobjectclasseshtm,1
an official tutorial is at httpdocsoraclecomjavasetutorialjavajavaoo ,1
an introductory tutorial on java would be a good place to start  interviewers can usually tell if youve never used the technology for which theyre interviewing before,1
maybe the hr just wanted to check your creativity applied to java language,1
i dont think there is a right answer for that,1
because 0 evaluates to false in boolean contexts,1
because 0 is falsey,1
for compatiblity with c 0 is implicitly convertible to false and nonzero is implicitly convertible to true,1
i is the same as i  0 in a boolean expression,1
use for int i  3 empty i to have infinite loop,1
or whiletrue cout  i    if you want to keep the while loop,1
please add code not screenshot,1
how to you expect to judge the realness of a persons name,1
if all elements are structured the same way id probably keep it simple and do elem1intelem1 for elem in mylist you could probably map it too,1
yes there are same structure,1
show us your attempt what is c supposed to be for just a count,1
var c  elementsselectmanye  eattributescounta  aname  city  agetvaluetostring  oakland,1
indexofobject,1
how is this the opposite of get,1
suggest you read the javadocs for list httpsdocsoraclecomjavase8docsapijavautillisthtml  should be obvious,1
are you asking how to get index position of that element in your list,1
  with get you input the index and it outputs the object with indexof you input the object and it outputs the index,1
oh ok  in that sense,1
just for the sake of correctness if your objects start as  they are probably lists and not arrays,1
where did you get stuck with this,1
read up on zip and for loops,1
print each name with a number  enumerate,1
not sure how to print each name with each numbers from the lists for example the first name is test and the first number 1 is 5 then the first number2 is 20 i want that all on one line for each one in the lists,1
if you read how to ask a good questionhttpstackoverflowcomhelphowtoask you may see that is asks you to create a mcve you should show your csv data how you read it into your lists then your expected output what does test 5 20 mean,1
test the name i said that already 5number1 20number2 all of which is inside the list from the csv file,1
what have you tried so far you could try using the calendar class and setting the month to january since its definitely the 2nd monday of the year will be in jan and getting the date of the first day of the week,1
what have your attempts at creating such an algorithm been,1
i dont know how to make an smooth movement i know the fixed movement identifiermovexy,1
there s no smooth or fixed movement just use smallers values,1
i guess you default package in eclipse is different from systemgetpropertyuserdir,1
yeah you missed the part where your statment question exlusivly refered to a singleton,1
the answer does not say such a thing private constructors are merely a way of enforcing the singleton pattern you only cheat it by having your main inside that class,1
making the constructor private is one of the things you need to do to implement the singleton pattern but its not the only thing and just this by itself does not automatically make it a singleton,1
so many downvotes should i delete the question,1
  you shouldnt you have already got 3 good answers,1
your example works httpideonecomwveg5y,1
what do you mean by correctly the newlines should be working what is the intended output,1
handleevent in maingame  is not overriden,1
unrelated to your problem but you redefine the member variables game and graphics in the child class since the base class is otherwise a pure abstract class it shouldnt really have any member variables,1
average means you need to add your numbers together and divide by how many numbers you added together,1
"there is no inbuilt average method in javascript
you need to write your own methodwhich is very straight forward this link wold help you of how u can do it better httpstackoverflowcomquestions10359907arraysumandaverage",1
try googling how do i get the average of two numbers hint it doesnt involve taking their minimum,1
i know what an average is im asking how i write the code to get that i am using appstudio im trying to learn and i dont know how to do this on my own aka why i came to this website,1
thing1thing22 if thing1 and thing2 are numeric types,1
is this javascript,1
im writing a tool to update this tool will create a script update to update in anothor database,1
do you have same table in each db,1
i have same table in other database so i need create script to update it,1
which dbms are you using add sample table data both tables before and after the script execution,1
the condition i  100 is false it should be i  100,1
  why,1
yes one person give the correct information so go with  ,1
  the loop executes as long as the condition is true i  100 is not true when the loop starts so it doesnt execute,1
  you have a backward understanding of how the condition works its not the test for when the loop should stop its the test for when the loop should keep repeating,1
the random numbers are irrelevant youd have the same problem with echo foo,1
  that makes more sense thanx,1
  i didnt understand because i asked this question yesterday linkhttpstackoverflowcomquestions40008544whycanthesecondforloopargumentnotbeequaltonumber4000858140008581 and was given a wrong answer i suppose,1
please dont downvote it if you have any suggestion for my question or answer then give otherwise dont do this without any comment,1
you can use view stub for dynamically change content  with condition of user type,1
you cant call the method listbox1opgeteld with two parameters if it only takes one you dont need the second one,1
you need to provide two arguments not only one,1
  please keep it in english non dutchies wont benefit from dutch answers,1
  english please,1
use gcc instead problem solved among numerous others oh and you should try stdioh instead note the lower case,1
maybe try a compiler that hasnt been obsolete for 15 years,1
please have a look at ask mcve,1
  as it turns outhttpstackoverflowcomdocumentationreviewchanges103112 this is not a homework question …   ☹,1
 nice finding,1
what kind of macro what are you emulating,1
the macro is from our ibm server we send out updates that are user intensive to streamline this and reduce errors i would like to create a macro that would first run the batch file to ftp the file to their as400 and then perform the functions on the as400 emulator side,1
just attach a debugger then i guess and look what it does if it still is in your sorting routine it takes long or just keep it running for a few hours and check back later,1
  thank you i will try hope everybody would be kind as you are everyone is trying to prove something here instead of helping anyone,1
 rust fwiw i think your question is appropriate for so if you want people to give you tipsbest practices i invite you to codereviewhttpcodereviewstackexchangecom otherwise keep posting here ,1
im confused why this is downvoted sure the codes not the best and the post could use some formatting but the question itself seems reasonable to me,1
  think so but they though it was useless and banned me from questioning for a while because of this,1
what did you try,1
i have to remove the 91 and 0 which are present in the beginning of the string containing the multiple data into it,1
  no there is no class here i work with jqgrid and sub grid jqgrid automatic set id for subgrid and i need the color of subgrid difference vs parent grid,1
unindent is the opposite of indent youve got too little whitespace in front of your code could you post the text of the error instead of an image,1
possible duplicate of indentationerror unindent does not match any outer indentation levelhttpstackoverflowcomquestions492387indentationerrorunindentdoesnotmatchanyouterindentationlevel,1
you should not post images of text on this site your required minimal complete and verifiable examplehttpstackoverflowcomhelpmcve must be in formatted text,1
unident one indent to rule them all,1
what have you tried to achieve your wanted results what has your research concerning your problem shown can you provide code of your tries how do i ask a good questionhttpsstackoverflowcomhelphowtoask how much research effort is expectedhttpsmetastackoverflowcomquestions261592howmuchresearcheffortisexpectedofstackoverflowusers and how to create a minimal complete and verifiable examplehttpsstackoverflowcomhelpmcve might be helpful to improve your question,1
not working means are you getting any error or exception,1
please use less capitals and more actual explanation,1
what is the actual issue didint get it,1
its not inserting to my table,1
do i have any problem to my subquery select  ,1
are you getting any error whats your c code which executes this query does sub query return exactly on result,1
i tried to remove subquery select and i just put any value that possible for its data type and its working but when i using subqueries select it doesnt working,1
baseheight2 what is your question,1
mayne you need herons formulahttpsenmwikipediaorgwikiheron27sformula,1
undefined behaviorhttpencppreferencecomwcpplanguageub,1
perfectly fine and undefined behavior is like walking with great joy on the streets of gold laced with land mineshttpsenwikipediaorgwikilandmine,1
also dont cast the result of mallochttpstackoverflowcomquestions605845doicasttheresultofmalloc,1
now the question isnt about c please settle on a language,1
what is your expected output and what is your actual output welcome to so please be sure to read about how to ask good questionshttpstackoverflowcomhelphowtoask,1
the question was about homebrew macports is not homebrew the op states they prefer not to use mac ports,1
  mac in new version dose not let you update openssl using homebrew i mean you can install or update it using homebrew but you can not prioritize it so instead of updating it using  homebrew you can update it using macports  and prioritize it,1
try swiftifyhttpobjectivec2swiftcom,1
"initindex int image uiimage 
        superinit
        selfindex  index
        selfimage  image
    ",1
given that you added an attempt and some specific problems you came across ill reopen this,1
theres still not enough information in the question to be answerable for example where is index and image defined in the swift code,1
the objectivec code isnt valid objectivec code and its not complete enough to help with a translation to swift,1
thanks all for comments and help i just realised the copy paste error on my obj c code  of course the first line should be   calaculatorhelppages,1
i tried swiftly as recommended and it produced code similar to the code producing errors,1
the comment from david pasztor pointed me to the issue causing the no member index error and i simply got rid of the call to superinit to clear up the last error  posted below the code im left with which seems to be working as i want without errors so happy days thanks ,1
change the order of script because  i had a problem  sometime jquery   should be load before any other lib,1
please add your html markup we need to see what your standard select element looks like,1
your scripts seem to be floating in no mans land either put them in your head or your body not between them not sure if thatll make any difference though,1
what have your tried,1
share your tries or the question will closed for no efforts soon,1
i tried ifaccholdattrcontainskyccnicind but i am confused how can i get value of this string,1
please see why is “can someone help me” not an actual questionhttpmetastackoverflowcomq284236,1
what do you mean the value of the string  surely it is kyccnicind but you already know that unless you want to extract the number after it  9110129505705 is that what you want,1
please write your question in english,1
this is an englishspeaking site you might be interested in httprustackoverflowcom,1
question was translated,1
владиславсильченко not the title,1
владиславсильченко httpsstackoverflowcomquestions22807010pickafilefromsdcardusingintent,1
yes it is proper call,1
first this has nothing to do with c so remove the c tag second i dont understand your question why do you want to call super is there a reason if so what if you dont have a reason why are you trying to use it,1
if you need to call super just do it there is nothing wrong,1
have you looked at the documentation for uibarbuttonitem theres an obvious init for using your own image,1
look around then post the questionhttpsdeveloperapplecomreferenceuikituibarbuttonitem,1
it could be useful for you httpwwwjobinandjismicomhowtochangeuibarbuttonitemimageprogrammaticallyinswift,1
"my bad i didnt mention my solutions here are the solutions which i tried elembindkeydown function event 
    if eventwhich  37 
 var target  eventtargetparentnodepreviouselementsibling     
 targettriggerfocus
    
    if eventwhich  39 
     consolelogright key pressed
  var target  eventtargetparentnodenextelementsibling
     targettriggerfocus
    
   ",1
i am able to focus li element with above coade but not able to do it for a which is inside li elementif you suggest any other solution it will be helpful,1
"thanks for the replies i got this worked by below codenot sure abt the performance of the code
 elembindkeydown function event 
    if eventwhich  37 
                var target  eventtargetparentnodepreviouselementsibling
    var x  targetchildren
                xfocus
    
    if eventwhich  39 
                consolelogright key pressed
                var target  eventtargetparentnodenextelementsibling
                var x  targetchildren
                xfocus

    
  ",1
what did you try so far,1
hi camilo i have not tried anything yet because i dont have a clue about how to approach the issue the closest hint i have had is using css variables but they dont appear to have wide browse support yet,1
use php to generate dynamic css httpscsstrickscomcssvariableswithphp so you can generate a dynamic css per user on the fly,1
interesting raymond thanks for the link,1
i am working on something similar are you going to store values per dom element or for the whole page as a total a simple implementation of color changing can be found here prodevsiteadmin click the logo to open the menu and from the settings you can quickly change page color perhaps creating a json settings file per user having the values of the colorsfont etc to store to database would be a good idea you could then pass the json to some javascript functions that will make the appropriate changes and complete the magic,1
  this is a great idea i am going to post an answer that makes use of json brilliant,1
httpencppreferencecomwcpperrorerrno,1
rtfm httpman7orglinuxmanpagesman2socket2html,1
have you searched for  you know  errno httpswwwgooglecomsearchqerrno,1
sorry everyone for my poorly worded question the question was ofcourse not about errno but that the error number persists across multiple library function calls,1
why use a regex when sstrip does exactly this,1
sstrip only handles the initial white space but not whitespace discovered after removing other unwanted characters note that this will remove even the whitespace after the final leading n,1
someone downvoted this answer but didnt explain why it is flawed shame on you   if the down vote was you please reverse as i explained your question and you didnt mention anything actually broken with my answer,1
rafe you might want to doublecheck sstrip produces precisely the same result as your regex,1
  youre confusing it with trim strip does the required operations,1
wow you are right thanks for pointing that out id like to delete this answer if possible is grayed out so maybe already done,1
you should get a couple of good books to readhttpsstackoverflowcoma388282440558 and learn about pointers they dont just magically point somewhere valid you have to make them point somewhere,1
when you attached your debugger to it and stepped through it line by line where did it fail,1
str points to some semirandom location stdcout tries to write to that location your operating system sees a rogue program trying to write to memory that doesnt belong to it and kills it,1
i asked google and this is the 2nd item in the search resulthttpwwwjavacreedcomwhatisdefensivecopying,1
ok i would do that before ask question,1
int main  return hello world ,1
  empty string works too in order to race for being short,1
httpsstackoverflowcomhelphowtoask,1
this sounds like an excellent opportunity to learn,1
yeah  were not going to write it for you and this is way too vague a description even if we were inclined to if you have a specific question well try to help what have you tried so far,1
can you please write it for me in short what i need is a python 34 program idk if it’s different but i say this version as i see people using print without brackets on other versions which will summon questions from an external file and the answers to the questions are also in an external file i need the code to check that the questions are correct aswell i’m just not sure how to write code which will summon a specific line and check if the answer is correct,1
 m i am sorry but we will not write your full code here that would be offtopic for stack overflow you can get help but you must show what you have tried and where you ran into problems so that we can help with a specific programming problem please see how do i ask and answer homework questionshttpmetastackoverflowcomq3348221288408,1
can you check the answers as i have posted my attempt there,1
what have you tried so far,1
0909,1
go with 0909,1
not working mavericks,1
it should allow only single dot,1
you said numbers like what other forms should be accepted is 123 number valid or should it be 12300 is 1234500 valid or 01 do you want to accept only two decimal places or can it change,1
yes number u have mentioned are valid  ,1
update your post to include rules you use to decide what is valid and what is not,1
yes number u have mentioned are valid i also mentioned 1234500 which has four digits after  so can we assume that  can have any number of digits after it like 12345600 would such number be valid or there is some rule which invalidates it if so what rule is it,1
  123400 is not validmy current rule is i just want only one decimal value and accept commain text field,1
  only one digit and one comma,1
  rudani only one dot of decimal,1
   multiple comma,1
  rudani yes multiple commas,1
  please check my ans for single dot,1
i dont understand your question  please edit your question and instead show us sample input and output in tabular form each line indented by 4 spaces to format it as code,1
whats your question,1
i have a string  to  my address  and 3 values in a separate table i need to replace these value by key my first value is 10 so the first key get replaced with 10 10 to  my address  and such,1
please provide a small sample so we are clear on exactly what you mean appears like you can just split up the values and add them to the key but i would like a small sample to verify everything works as intended,1
what dialect of sql are you using  add a tag for that as well,1
for a start move that expression into a function and use stdisdigit for the numerical bit,1
if the function works correctly i recommend coming to codereviewse it would be nice to include a test main in the post there,1
where did the string come from it could be easier to check each character as the text comes in rather than all at once afterwords,1
it comes from cingetlineequation100 also we are learning functions and i was told to do it that way,1
it’s c use stdstring,1
  were you thinking about stdistreamiteratorchar and stdallof,1
note that c doesnt guarantee the character set that will be used,1
load the allowed characters as keys of an unorderedmap then query each candidate character if a char is not in the unorderedmap then an unallowed character is present and process accordingly,1
you are looping through the passwordfor i in range lenpassword and accessing it,1
this is a very inefficient way to check for unique characters def checkpass password  inputenter a password  return lenpassword  lensetpassword,1
what have you written so far,1
i see title and content questions different can you explain better what you want,1
the code you provided wont compile you need commas in your array,1
the part of the question after sorted array seems to be a part of a completely different problem,1
debug your code and find out which line exactly the program crashes  check to see if your initializer is really being called  ive never seen the controller initializer being customized like you did  i suspect your lists is never initialized  empty array will not raise an error in your case empty array is not equivalent to nil,1
im just curious what exactly do you expect to get,1
pointer arithmetichttpstackoverflowcoma394774620908  google searchhttpswwwgooglecomsearchqc2b2bpointerarithmetic,1
have you tried to start structuring the html,1
i want my portfolio design it in html and css let me know once completed,1
im still beginner ive triedplease send related document or links  ,1
  httpwwww3schoolscom,1
splithttpsmsdnmicrosoftcomenuslibrarysystemstringsplitvvs110aspx on space then append the first char from the 2nd string to the first string,1
i was using trim but it was only taking out blank spaces and when i wrote the second word the spaces appears also thanks,1
whats your expected input and output,1
my input is initialized in char input assume it as encypted text and my result should be 3 hello world ,1
i am searching it from yesterday and yes i am not able to convey properly that what exactly i want,1
from my search i found that brute force and frequency analysis can d the trick but i cant understand how frequency analysis can work for my situation,1
note inputix26 is the same as inputix26  did you want inputix26,1
i want inputix26,1
please edit your question instead of adding comments so that everything is in one place and you can format it,1
why are you using typeidname what exactly is it you want to achieve,1
code is tagc why the tagc tag,1
unclear what youre asking i also feel wrong with assigning a pointer to array,1
is it possible to define your own variable type and then use it as any other variable well thats one of the purposes of c,1
can you show the code that you would like to write as it stands the question is completely unclear,1
  thats initializating a char array from a string literal that does not exceed the size of the array not assignment it is valid,1
the whole point of struct is to define your own types so you are pretty much asking if you can define your own types without doing what is required to define your own type,1
what typeidaname returns is not defined by c it is down to the compiler writers it can be different for every compiler,1
you have it in my answer ,1
oh nice thanks,1
yeah i dont want to use stuct doesnt look good then use a language whose syntax suits you better aesthetically,1
  in c userdefined types are introduced with keyword class struct or union its unclear what you dont like about them and what youre actually trying to achieve if you explain better what doesnt look good means there might be a way to answer you,1
stdstring is a class just like your struct,1
heres a novel idea dont actually send the email until its ready to be sent just store it somewhere until its ready,1
ok i am not asking anybody to do my job just asking if there is anybody that has done something like what i am asking the reason i posted the question is because looking here httpsmsdnmicrosoftcomenuslibrarysystemnetmailsmtpclientvvs110aspx there is no onsend or beforesend or something like that the smtpclient class only provides sendcompleted event,1
"youll need a way to intercept the message first how is the message being sent can you host a smart relay that does this do you need to program something new to do it or do any existing tools already perform this functionality there are lots of smart smtp servers out there

what exactly is the question again",1
  and joedm i just edited the question hope it is clear now,1
incidentally i assume that this is an email client you wrote or otherwise control the code of or are you trying to do an outlook plugin or something like that this is a very different question if youre trying to do this with a third party tool like outlook,1
also do you control the smtp servers,1
i have already done a plugin for outlook that does the same very big difference is that outlook object model do expose an itemsend event that allows me to cancel the sending operation i am trying to generalize the solutions to all mail clients that is why i ran into this and no i do not have any control on the smtp server,1
do you get an error,1
what is your problem i didnt run it but this code looks fine,1
well you have a syntax error on the datapop line,1
try this datapopmydeletenumber ,1
not only is your code poorly indented it contains break and continue outside a loop,1
  sorry it is in a loop just the loop is outside the snippet i am showing you,1
your code doesnt run the command,1
parameterized queries minimizes sql injection when cmdexecutenonquery executes  the injection often occurs when using concatenated values in a query string what exactly youve tried to do,1
try executing your command maybe something will happen,1
you form the command just fine but never execute it,1
